{
  "schema_version": "investigation-result.v1",
  "investigation_id": "cir_checkout_post_api_pay_20260418t120024z_cloud",
  "packet_id": "ipk_checkout_post_api_pay_20260418t120008z",
  "decision_id": "lad_checkout_post_pay_20260418t120010z",
  "parent_investigation_id": "cir_checkout_post_api_pay_20260418t120012z",
  "investigator_tier": "cloud_fallback_investigator",
  "model_provider": "openai",
  "model_name": "cloud-fallback-pending",
  "generated_at": "2026-04-18T12:00:24Z",
  "input_refs": {
    "packet_id": "ipk_checkout_post_api_pay_20260418t120008z",
    "decision_id": "lad_checkout_post_pay_20260418t120010z",
    "retrieval_packet_ids": [
      "ipk_checkout_post_pay_20260411t110000z"
    ],
    "prometheus_query_refs": [
      "prom://query/high_error_rate_window_300s"
    ],
    "signoz_query_refs": [
      "signoz://trace/query-123",
      "signoz://logs/query-456"
    ],
    "code_search_refs": [
      "services/checkout/post_api_pay.py",
      "repos/checkout-service/post_api_pay"
    ],
    "upstream_report_id": null
  },
  "summary": {
    "investigation_used": true,
    "severity_band": "P1",
    "recommended_action": "page_owner",
    "confidence": 0.83,
    "reason_codes": [
      "error_rate_spike",
      "template_novelty_high",
      "similar_to_past_severe"
    ],
    "suspected_primary_cause": "db timeout on order lookup",
    "failure_chain_summary": "cloud fallback reviewed the bounded local handoff for checkout POST /api/pay and retained db timeout on order lookup as the leading failure chain driver."
  },
  "hypotheses": [
    {
      "rank": 1,
      "hypothesis": "cloud fallback confirms db timeout on order lookup as the most likely driver of the checkout regression on POST /api/pay",
      "confidence": 0.83,
      "supporting_reason_codes": [
        "error_rate_spike",
        "template_novelty_high",
        "similar_to_past_severe"
      ]
    },
    {
      "rank": 2,
      "hypothesis": "next validation should inspect services/checkout/post_api_pay.py before broader mitigation decisions",
      "confidence": 0.66,
      "supporting_reason_codes": [
        "cloud_handoff_review"
      ]
    }
  ],
  "analysis_updates": {
    "severity_band_changed": false,
    "recommended_action_changed": false,
    "fallback_invocation_was_correct": true,
    "notes": [
      "cloud_fallback_smoke_result",
      "handoff_tokens_estimate=238",
      "cloud_fallback_invoked_after_local_primary_handoff"
    ]
  },
  "routing": {
    "owner_hint": "payments-oncall",
    "repo_candidates": [
      "checkout-service",
      "payment-gateway-client"
    ],
    "suspected_code_paths": [
      "services/checkout/post_api_pay.py",
      "repos/checkout-service/post_api_pay",
      "repos/payment-gateway-client/post_api_pay"
    ],
    "escalation_target": "payments-oncall"
  },
  "evidence_refs": {
    "prometheus_ref_ids": [
      "prom://query/high_error_rate_window_300s"
    ],
    "signoz_ref_ids": [
      "signoz://trace/query-123",
      "signoz://logs/query-456"
    ],
    "trace_ids": [
      "7f8a3c",
      "7f8a40"
    ],
    "code_refs": [
      "services/checkout/post_api_pay.py",
      "repos/checkout-service/post_api_pay"
    ]
  },
  "unknowns": [
    "bounded local follow-up used repo_search only; live metric/log follow-up remains pending",
    "deterministic cloud fallback smoke client is active; live vendor API integration remains pending"
  ],
  "compressed_handoff": {
    "handoff_markdown": "# Cloud Fallback Handoff\n- packet_id: ipk_checkout_post_api_pay_20260418t120008z\n- decision_id: lad_checkout_post_pay_20260418t120010z\n- parent_investigation_id: cir_checkout_post_api_pay_20260418t120012z\n- service: checkout\n- operation: POST /api/pay\n- severity_band: P1\n- recommended_action: page_owner\n- parent_confidence: 0.75\n- suspected_primary_cause: db timeout on order lookup\n- top_hypothesis: db timeout on order lookup is driving the checkout regression on POST /api/pay\n- owner_hint: payments-oncall\n- repo_candidates: checkout-service, payment-gateway-client\n- retrieval_packet_ids: ipk_checkout_post_pay_20260411t110000z\n- prometheus_refs: prom://query/high_error_rate_window_300s\n- signoz_refs: signoz://trace/query-123, signoz://logs/query-456\n- code_refs: services/checkout/post_api_pay.py, repos/checkout-service/post_api_pay\n- local_unknowns: bounded local follow-up used repo_search only; live metric/log follow-up remains pending",
    "handoff_tokens_estimate": 238,
    "carry_reason_codes": [
      "error_rate_spike",
      "template_novelty_high",
      "similar_to_past_severe"
    ]
  }
}
